Politicians,Politician Title,url,"May 08, 2023","May 09, 2023","May 10, 2023","May 11, 2023","May 12, 2023","May 13, 2023","May 14, 2023","May 15, 2023"
Anthony Albanese, Prime Minister,https://upload.wikimedia.org/wikipedia/commons/a/ad/Anthony_Albanese_portrait_%28cropped%29.jpg,0,33,24,14,13,7,5,29
Jim Chalmers, Treasurer,https://upload.wikimedia.org/wikipedia/commons/9/9c/Jim_Chalmers_2020.jpg,0,69,35,9,10,5,13,29
Mark Butler, Minister for Health & Aged Care,https://upload.wikimedia.org/wikipedia/commons/8/89/Mark_Butler_2016.jpg,0,15,9,6,4,7,3,18
Chris Bowen, Minister for Climate Change & Energy,https://upload.wikimedia.org/wikipedia/commons/1/11/Chris_Bowen_2022.jpg,0,22,8,10,10,2,4,18
Peter Dutton, Leader of the Opposition,https://upload.wikimedia.org/wikipedia/commons/c/cd/Peter-Dutton-2022.jpg,0,13,6,2,20,7,3,14
