Politicians,Politician Title,url,"April 23, 2023","April 24, 2023","April 25, 2023","April 26, 2023","April 27, 2023","April 28, 2023","April 29, 2023","April 30, 2023"
Anthony Albanese, Prime Minister,https://upload.wikimedia.org/wikipedia/commons/a/ad/Anthony_Albanese_portrait_%28cropped%29.jpg,0,31,7,16,25,21,29,28
Jim Chalmers, Treasurer,https://upload.wikimedia.org/wikipedia/commons/9/9c/Jim_Chalmers_2020.jpg,0,4,2,7,11,2,11,19
Bill Shorten, Minister for the National Disability Insurance Scheme; Minister for Government Services,https://upload.wikimedia.org/wikipedia/commons/7/7d/Bill_Shorten-crop.jpg,0,8,1,9,12,4,7,13
Bridget Mckenzie, Shadow Minister for Infrastructure; Transport & Regional Development,https://upload.wikimedia.org/wikipedia/commons/5/53/Bridget_McKenzie_2019.jpg,0,3,3,1,2,1,1,12
Chris Bowen, Minister for Climate Change & Energy,https://upload.wikimedia.org/wikipedia/commons/1/11/Chris_Bowen_2022.jpg,0,9,2,3,3,2,5,10
