Politicians,Politician Title,url,"May 08, 2023","May 09, 2023","May 10, 2023","May 11, 2023","May 12, 2023","May 13, 2023","May 14, 2023","May 15, 2023"
Jim Chalmers, Treasurer,https://upload.wikimedia.org/wikipedia/commons/9/9c/Jim_Chalmers_2020.jpg,99,69,35.0,9.0,10.0,5.0,13.0,23.0
Anthony Albanese, Prime Minister,https://upload.wikimedia.org/wikipedia/commons/a/ad/Anthony_Albanese_portrait_%28cropped%29.jpg,84,33,24.0,14.0,13.0,7.0,5.0,16.0
Katy Gallagher, Minister for Finance; Minister for Women; Minister for Public Service,https://upload.wikimedia.org/wikipedia/commons/3/32/Katy_Gallagher_2022.jpg,72,11,7.0,6.0,4.0,3.0,1.0,4.0
Bill Shorten, Minister for the National Disability Insurance Scheme; Minister for Government Services,https://upload.wikimedia.org/wikipedia/commons/7/7d/Bill_Shorten-crop.jpg,49,7,6.0,0.0,6.0,4.0,3.0,4.0
Penny Wong, Minister for Foreign Affairs,https://upload.wikimedia.org/wikipedia/commons/3/35/Penny_Wong_DFAT_official_%28cropped%29.jpg,48,19,8.0,5.0,7.0,2.0,4.0,7.0
