Politicians,Politician Title,url,"April 29, 2023","April 30, 2023","May 01, 2023","May 02, 2023","May 03, 2023","May 04, 2023","May 05, 2023","May 06, 2023"
Anthony Albanese, Prime Minister,https://upload.wikimedia.org/wikipedia/commons/a/ad/Anthony_Albanese_portrait_%28cropped%29.jpg,0,33,48,22.0,21.0,23.0,22.0,10.0
Jim Chalmers, Treasurer,https://upload.wikimedia.org/wikipedia/commons/9/9c/Jim_Chalmers_2020.jpg,0,21,20,23.0,46.0,17.0,29.0,10.0
Bill Shorten, Minister for the National Disability Insurance Scheme; Minister for Government Services,https://upload.wikimedia.org/wikipedia/commons/7/7d/Bill_Shorten-crop.jpg,0,16,9,9.0,14.0,10.0,8.0,2.0
Chris Bowen, Minister for Climate Change & Energy,https://upload.wikimedia.org/wikipedia/commons/1/11/Chris_Bowen_2022.jpg,0,13,10,3.0,19.0,6.0,12.0,8.0
Katy Gallagher, Minister for Finance; Minister for Women; Minister for Public Service,https://upload.wikimedia.org/wikipedia/commons/3/32/Katy_Gallagher_2022.jpg,0,12,0,0.0,0.0,0.0,0.0,0.0
